{
  "$schema": "../schemas/project.schema.json",
  "schema_version": "0.1.0",
  "project_id": "sample-physics-project",
  "language": "ko-KR",
  "workflow": {
    "status": "source_only",
    "revision": 1,
    "created_at": "2026-08-24T18:00:00+09:00",
    "updated_at": "2026-08-24T18:00:00+09:00"
  },
  "metadata": {
    "year": "2026",
    "semester": "1",
    "exam_type": "worksheet",
    "school": "sample-school",
    "school_level": "high",
    "grade": "2",
    "subject": "physics",
    "filename_base": "sample-physics",
    "range": null,
    "publisher": null,
    "book_title": null,
    "book_volume": null,
    "book_type": null
  },
  "item_order": ["item-physics-0001"],
  "groups": [],
  "rendering": {
    "question_design_profile_ref": null,
    "explanation_design_profile_ref": null
  },
  "export": {
    "renderer": "native_ordered",
    "output_mode": "separate_hwpx",
    "shared_item_policy": "explicit_item_order",
    "include_answers": true,
    "include_explanations": true,
    "engine_id": null,
    "engine_fingerprint_sha256": null
  }
}
